<?xml version="1.0" encoding="UTF-8"?>
<estimate xmlns:xsi="http://www.w3.org/2001/XMLSchema-instance"
	xsi:noNamespaceSchemaLocation="estimate.xsd">
	<society>
		<name></name>
		<vat_number></vat_number>
		<address>
			<number></number>
			<street></street>
			<zip></zip>
			<city></city>
		</address>
		<contact_info>
			<phone></phone>
			<fax></fax>
			<mobile></mobile>
			<email></email>
			<website></website>
		</contact_info>
	</society>
	<customer>
		<name></name>
		<first_name></first_name>
		<address>
			<number></number>
			<street></street>
			<zip></zip>
			<city></city>
		</address>
	</customer>
	<creation_date></creation_date>
	<number></number>
	<details>
		<detail>
			<product>
				<number></number>
				<name></name>
			</product>
			<quantity></quantity>
			<price></price>
			<total_et></total_et>
		</detail>
	</details>
	<total_et></total_et>
	<vat></vat>
	<total_ati></total_ati>
</estimate>
